sku,name,brand,category,price,short_description,long_description,attributes
SKU-0171,The Wonderful Wizard of Oz,Scholastic,Books,7.99,A classic children's adventure to a magical land.,Presented by Fnac.fr. The Wonderful Wizard of Oz follows Dorothy and her companions on a journey along the yellow brick road. L. Frank Baum's enduring tale remains a staple of children's literature.,"{""author"": ""L. Frank Baum"", ""genre"": ""Children"", ""format"": ""Paperback"", ""pages"": 160, ""language"": ""English""}"
SKU-0172,The Dark Side of the Moon,Pink Floyd Records,Vinyl Records,27.99,A landmark progressive rock album on vinyl.,"Presented by Fnac.fr. The Dark Side of the Moon presents Pink Floyd's seamless suite exploring time, money, and the mind. This LP pressing suits collectors and listeners who value the album as a continuous work.","{""artist"": ""Pink Floyd"", ""genre"": ""Rock"", ""format"": ""LP"", ""release_year"": 1973, ""rpm"": ""33""}"
SKU-0173,Rumours,Warner Records,Vinyl Records,25.99,Fleetwood Mac's enduring pop-rock classic.,"Presented by Fnac.fr. Rumours captures Fleetwood Mac's interpersonal tensions in a set of polished, melodic songs. This LP pressing remains a staple for fans of melodic pop-rock.","{""artist"": ""Fleetwood Mac"", ""genre"": ""Pop"", ""format"": ""LP"", ""release_year"": 1977, ""rpm"": ""33""}"
SKU-0174,Kind of Blue,Columbia Records,Vinyl Records,24.99,A defining modal jazz album on vinyl.,Presented by Fnac.fr. Kind of Blue gathers Miles Davis and his ensemble for an influential set of modal jazz. This LP pressing is a cornerstone choice for jazz listeners and collectors.,"{""artist"": ""Miles Davis"", ""genre"": ""Jazz"", ""format"": ""LP"", ""release_year"": 1959, ""rpm"": ""33""}"
SKU-0175,What's Going On,Motown Records,Vinyl Records,26.99,A soul classic addressing social themes.,"Presented by Fnac.fr. What's Going On weaves Marvin Gaye's reflections on war, ecology, and injustice into a flowing soul suite. This LP pressing remains a touchstone for soul and R&B collectors.","{""artist"": ""Marvin Gaye"", ""genre"": ""Soul"", ""format"": ""LP"", ""release_year"": 1971, ""rpm"": ""33""}"
SKU-0176,To Pimp a Butterfly,Aftermath Records,Vinyl Records,32.99,An acclaimed hip-hop double LP.,"Presented by Fnac.fr. To Pimp a Butterfly blends jazz, funk, and spoken word across Kendrick Lamar's ambitious narrative. This double LP pressing appeals to listeners who value the album's full sequencing.","{""artist"": ""Kendrick Lamar"", ""genre"": ""Hip-Hop"", ""format"": ""Double LP"", ""release_year"": 2015, ""rpm"": ""33""}"
SKU-0177,Random Access Memories,Columbia Records,Vinyl Records,34.99,Daft Punk's electronic-disco double LP.,Presented by Fnac.fr. Random Access Memories pairs Daft Punk's electronic production with live disco and funk musicianship. This double LP pressing is a favourite for fans of richly produced electronic music.,"{""artist"": ""Daft Punk"", ""genre"": ""Electronic"", ""format"": ""Double LP"", ""release_year"": 2013, ""rpm"": ""33""}"
SKU-0178,Symphony No. 9,Deutsche Grammophon,Vinyl Records,29.99,A celebrated recording of Beethoven's Ninth.,"Presented by Fnac.fr. This pressing presents Beethoven's Symphony No. 9, including the famous choral finale. It suits classical collectors who appreciate the work on vinyl.","{""artist"": ""Ludwig van Beethoven"", ""genre"": ""Classical"", ""format"": ""LP"", ""release_year"": 1963, ""rpm"": ""33""}"
SKU-0179,Blue,Reprise Records,Vinyl Records,26.99,Joni Mitchell's intimate folk landmark.,"Presented by Fnac.fr. Blue gathers Joni Mitchell's confessional songwriting in a spare, intimate folk setting. This LP pressing remains a key album for folk and singer-songwriter collectors.","{""artist"": ""Joni Mitchell"", ""genre"": ""Folk"", ""format"": ""LP"", ""release_year"": 1971, ""rpm"": ""33""}"
SKU-0180,Live at the Apollo (45 RPM Edition),King Records,Vinyl Records,31.99,A landmark live soul recording at 45 RPM.,Presented by Fnac.fr. This 45 RPM pressing captures James Brown's electrifying live performance with added fidelity. The faster speed appeals to collectors who prioritise sound quality.,"{""artist"": ""James Brown"", ""genre"": ""Soul"", ""format"": ""LP"", ""release_year"": 1963, ""rpm"": ""45""}"
SKU-0181,Dyson Supersonic,Dyson,Hair Dryers,399.0,Fast-drying hair dryer with heat control.,Presented by Fnac.fr. The Dyson Supersonic uses a compact digital motor and intelligent heat control to help protect hair from extreme temperatures. Magnetic attachments and a balanced design make it comfortable for daily styling.,"{""power_w"": 1600, ""color"": ""Iron/Fuchsia"", ""ionic"": ""Yes"", ""attachments"": ""Smoothing nozzle, Diffuser, Styling concentrator"", ""weight_g"": 659}"
SKU-0182,ghd Helios,ghd,Hair Dryers,179.0,"Lightweight dryer for fast, smooth results.","Presented by Fnac.fr. The ghd Helios pairs a high-speed motor with ionic technology to dry hair quickly while reducing frizz. A balanced, lightweight body makes it comfortable for everyday and professional use.","{""power_w"": 2200, ""color"": ""Black"", ""ionic"": ""Yes"", ""attachments"": ""Concentrator nozzle"", ""weight_g"": 600}"
SKU-0183,Shark HyperAIR,Shark,Hair Dryers,199.0,Multi-styler dryer with auto-wrap attachments.,Presented by Fnac.fr. The Shark HyperAIR combines fast drying with attachments that use airflow to style and curl. Ionic technology and heat control make it a versatile all-in-one styling tool.,"{""power_w"": 1600, ""color"": ""Stone"", ""ionic"": ""Yes"", ""attachments"": ""Auto-wrap curlers, Styling concentrator, Diffuser"", ""weight_g"": 700}"
SKU-0184,Revlon One-Step Volumizer Plus,Revlon,Hair Dryers,59.0,Hot air brush for drying and volumising in one step.,Presented by Fnac.fr. The Revlon One-Step Volumizer Plus combines a dryer and brush to smooth and add volume in a single pass. Ionic technology helps reduce frizz for an easy at-home blow-dry.,"{""power_w"": 1100, ""color"": ""Black"", ""ionic"": ""Yes"", ""attachments"": ""Oval brush head"", ""weight_g"": 550}"
SKU-0185,BaByliss Super Power Pro 2200,BaByliss,Hair Dryers,39.0,Powerful everyday dryer with multiple settings.,Presented by Fnac.fr. The BaByliss Super Power Pro 2200 offers strong airflow with multiple heat and speed settings for fast drying. Ionic conditioning and a slim nozzle make it a dependable everyday dryer.,"{""power_w"": 2200, ""color"": ""Black"", ""ionic"": ""Yes"", ""attachments"": ""Concentrator nozzle, Diffuser"", ""weight_g"": 500}"
SKU-0186,Remington Pro-Air Shine,Remington,Hair Dryers,34.0,Affordable dryer with ceramic coating.,Presented by Fnac.fr. The Remington Pro-Air Shine uses a ceramic coating and ionic technology to help reduce frizz and add shine. Multiple settings and a cool shot make it a budget-friendly everyday choice.,"{""power_w"": 2300, ""color"": ""Black"", ""ionic"": ""Yes"", ""attachments"": ""Concentrator nozzle, Diffuser"", ""weight_g"": 520}"
SKU-0187,Panasonic Nanoe EH-NA67,Panasonic,Hair Dryers,89.0,Dryer with moisture-rich nanoe technology.,Presented by Fnac.fr. The Panasonic Nanoe EH-NA67 releases fine moisture particles intended to help condition hair while drying. Multiple heat settings and a diffuser make it suitable for a range of hair types.,"{""power_w"": 1800, ""color"": ""Pink"", ""ionic"": ""Yes"", ""attachments"": ""Concentrator nozzle, Diffuser"", ""weight_g"": 555}"
SKU-0188,T3 AireLuxe,T3,Hair Dryers,199.0,Quiet dryer with adjustable heat and speed.,Presented by Fnac.fr. The T3 AireLuxe offers a quiet digital motor with independent heat and speed controls for tailored drying. Ionic technology helps smooth hair for a polished finish at home.,"{""power_w"": 1875, ""color"": ""White/Rose Gold"", ""ionic"": ""Yes"", ""attachments"": ""Concentrator nozzle, Diffuser"", ""weight_g"": 540}"
SKU-0189,Bosch BrilliantCare Keratin,Bosch,Hair Dryers,45.0,Everyday dryer with keratin-friendly settings.,"Presented by Fnac.fr. The Bosch BrilliantCare offers a dedicated lower-temperature mode aimed at gentler, keratin-friendly drying. Ionic conditioning and multiple settings make it a practical home dryer.","{""power_w"": 2000, ""color"": ""Black"", ""ionic"": ""Yes"", ""attachments"": ""Concentrator nozzle"", ""weight_g"": 480}"
SKU-0190,Oral-B iO Series 9,Oral-B,Electric Toothbrushes,299.0,Smart toothbrush with real-time brushing guidance.,Presented by Fnac.fr. The Oral-B iO Series 9 uses a quiet magnetic motor and app-connected sensors to guide brushing across the mouth. Multiple modes and a pressure sensor help support a consistent daily routine.,"{""color"": ""Black Onyx"", ""brushing_modes"": 7, ""battery_life_days"": 14, ""connectivity"": ""Bluetooth"", ""pressure_sensor"": ""Yes""}"
SKU-0191,Philips Sonicare DiamondClean 9000,Philips,Electric Toothbrushes,249.0,Sonic toothbrush with app-guided cleaning.,Presented by Fnac.fr. The Sonicare DiamondClean 9000 uses sonic technology and connected coaching to support thorough cleaning. Multiple modes and a pressure sensor help protect gums during daily use.,"{""color"": ""Pink"", ""brushing_modes"": 4, ""battery_life_days"": 14, ""connectivity"": ""Bluetooth"", ""pressure_sensor"": ""Yes""}"
SKU-0192,Oral-B Pro 3 3000,Oral-B,Electric Toothbrushes,79.0,Daily toothbrush with a visible pressure sensor.,Presented by Fnac.fr. The Oral-B Pro 3 3000 offers oscillating cleaning with a visible pressure sensor that alerts on hard brushing. Three modes and a two-week battery make it a solid everyday choice.,"{""color"": ""White"", ""brushing_modes"": 3, ""battery_life_days"": 14, ""connectivity"": ""None"", ""pressure_sensor"": ""Yes""}"
SKU-0193,Philips Sonicare ProtectiveClean 5100,Philips,Electric Toothbrushes,89.0,Sonic toothbrush with pressure protection.,Presented by Fnac.fr. The Sonicare ProtectiveClean 5100 delivers sonic cleaning with a pressure sensor and a brush-head reminder. Multiple modes and a two-week battery make it a dependable daily brush.,"{""color"": ""Blue"", ""brushing_modes"": 3, ""battery_life_days"": 14, ""connectivity"": ""None"", ""pressure_sensor"": ""Yes""}"
SKU-0194,Colgate hum,Colgate,Electric Toothbrushes,49.0,Connected toothbrush for everyday cleaning.,Presented by Fnac.fr. The Colgate hum pairs a sonic motor with an app that tracks coverage and brushing habits. A pressure sensor and rechargeable battery make it an accessible smart brush.,"{""color"": ""Teal"", ""brushing_modes"": 3, ""battery_life_days"": 10, ""connectivity"": ""Bluetooth"", ""pressure_sensor"": ""Yes""}"
SKU-0195,Oclean X Pro,Oclean,Electric Toothbrushes,69.0,Sonic toothbrush with a touchscreen display.,Presented by Fnac.fr. The Oclean X Pro features a colour touchscreen and app connectivity to track brushing zones and timing. A pressure sensor and long battery life make it a feature-rich daily brush.,"{""color"": ""Grey"", ""brushing_modes"": 4, ""battery_life_days"": 30, ""connectivity"": ""Bluetooth"", ""pressure_sensor"": ""Yes""}"
SKU-0196,Quip Smart Electric Toothbrush,Quip,Electric Toothbrushes,45.0,Slim sonic toothbrush with a simple design.,"Presented by Fnac.fr. The Quip Smart toothbrush offers a slim, travel-friendly design with a sonic motor and a built-in timer. App tracking and a guiding pressure cue make it a minimalist everyday option.","{""color"": ""Silver"", ""brushing_modes"": 1, ""battery_life_days"": 90, ""connectivity"": ""Bluetooth"", ""pressure_sensor"": ""No""}"
SKU-0197,Fairywill P11,Fairywill,Electric Toothbrushes,29.0,Affordable sonic toothbrush with multiple modes.,"Presented by Fnac.fr. The Fairywill P11 delivers sonic cleaning with several modes and a long-lasting battery at a low price. A built-in timer makes it an easy, budget-friendly daily brush.","{""color"": ""Black"", ""brushing_modes"": 5, ""battery_life_days"": 30, ""connectivity"": ""None"", ""pressure_sensor"": ""No""}"
SKU-0198,Spotlight Oral Care Sonic Toothbrush,Spotlight Oral Care,Electric Toothbrushes,99.0,Sonic toothbrush with multiple cleaning modes.,Presented by Fnac.fr. The Spotlight Oral Care Sonic Toothbrush offers several cleaning modes and a guiding timer for a consistent routine. A long battery life and a pressure sensor make it a well-rounded daily brush.,"{""color"": ""Rose Gold"", ""brushing_modes"": 4, ""battery_life_days"": 30, ""connectivity"": ""None"", ""pressure_sensor"": ""Yes""}"
