sku,name,brand,category,price,short_description,long_description,attributes
SKU-0113,Nintendo Switch OLED,Nintendo,Consoles,349.0,Hybrid console with a vivid OLED screen.,Presented by Fnac.fr. The Nintendo Switch OLED upgrades the handheld experience with a brighter 7-inch OLED screen. Seamless TV and handheld play make it a flexible console for solo and party gaming.,"{""platform"": ""Nintendo Switch"", ""storage_gb"": 64, ""edition"": ""Standard"", ""color"": ""White"", ""generation"": ""Eighth""}"
SKU-0114,Valve Steam Deck OLED,Valve,Consoles,569.0,Handheld PC for your Steam library on the go.,Presented by Fnac.fr. The Steam Deck OLED runs PC games in a handheld form with a vivid OLED screen and improved battery. A full Steam library and desktop mode make it a versatile portable for PC players.,"{""platform"": ""SteamOS"", ""storage_gb"": 512, ""edition"": ""Standard"", ""color"": ""Black"", ""generation"": ""Handheld""}"
SKU-0115,ASUS ROG Ally X,ASUS,Consoles,899.0,Windows handheld for high-performance portable gaming.,Presented by Fnac.fr. The ROG Ally X runs full Windows on a bright handheld display for demanding PC games anywhere. A larger battery and refined ergonomics make it a strong portable for power users.,"{""platform"": ""Windows"", ""storage_gb"": 1024, ""edition"": ""Standard"", ""color"": ""Black"", ""generation"": ""Handheld""}"
SKU-0116,Sony PlayStation 5 Pro,Sony,Consoles,799.0,Enhanced PS5 for higher-fidelity gaming.,"Presented by Fnac.fr. The PlayStation 5 Pro adds more graphics power and upscaling for higher-fidelity, smoother gameplay. A large SSD and the DualSense controller make it a choice for players wanting maximum visuals.","{""platform"": ""PlayStation 5"", ""storage_gb"": 2048, ""edition"": ""Digital"", ""color"": ""White"", ""generation"": ""Ninth""}"
SKU-0117,Microsoft Xbox Series X Galaxy Black,Microsoft,Consoles,599.0,Special-edition Xbox with extra storage.,Presented by Fnac.fr. This special-edition Xbox Series X pairs a unique finish with extra storage for larger game libraries. The same strong 4K performance and Game Pass support make it a collector-friendly bundle.,"{""platform"": ""Xbox"", ""storage_gb"": 2048, ""edition"": ""Bundle"", ""color"": ""Black"", ""generation"": ""Ninth""}"
SKU-0118,The Legend of Zelda: Tears of the Kingdom,Nintendo,Video Games,59.0,Open-world adventure across land and sky.,Presented by Fnac.fr. Tears of the Kingdom expands Hyrule with new sky islands and inventive crafting and building mechanics. Its open-ended exploration and physics-driven puzzles make it a standout adventure on Switch.,"{""platform"": ""Nintendo Switch"", ""genre"": ""Adventure"", ""pegi_rating"": ""12"", ""edition"": ""Standard"", ""release_year"": 2023}"
SKU-0119,Elden Ring,Bandai Namco,Video Games,49.0,Challenging open-world action RPG.,Presented by Fnac.fr. Elden Ring blends FromSoftware's demanding combat with a vast open world and deep character builds. Its interconnected design and challenging bosses make it a landmark action RPG.,"{""platform"": ""PlayStation 5"", ""genre"": ""Action RPG"", ""pegi_rating"": ""16"", ""edition"": ""Standard"", ""release_year"": 2022}"
SKU-0120,Marvel's Spider-Man 2,Sony,Video Games,69.0,Open-world superhero action across New York.,Presented by Fnac.fr. Spider-Man 2 lets players swing through a detailed New York with two playable heroes and fluid combat. A cinematic story and fast traversal make it a showcase action title for PS5.,"{""platform"": ""PlayStation 5"", ""genre"": ""Action"", ""pegi_rating"": ""16"", ""edition"": ""Standard"", ""release_year"": 2023}"
SKU-0121,EA Sports FC 25,EA Sports,Video Games,69.0,Football simulation with realistic gameplay.,Presented by Fnac.fr. EA Sports FC 25 brings updated rosters and refined gameplay to the long-running football series. Career and online modes make it a staple for fans of the sport.,"{""platform"": ""PlayStation 5"", ""genre"": ""Sports"", ""pegi_rating"": ""3"", ""edition"": ""Standard"", ""release_year"": 2024}"
SKU-0122,Forza Horizon 5,Xbox Game Studios,Video Games,59.0,Open-world racing across a vibrant Mexico.,Presented by Fnac.fr. Forza Horizon 5 offers a huge open-world map of Mexico with a deep car roster and dynamic seasons. Accessible driving and varied events make it a broadly appealing racing game.,"{""platform"": ""Xbox"", ""genre"": ""Racing"", ""pegi_rating"": ""3"", ""edition"": ""Standard"", ""release_year"": 2021}"
SKU-0123,Baldur's Gate 3,Larian Studios,Video Games,59.0,Story-rich role-playing with deep choices.,Presented by Fnac.fr. Baldur's Gate 3 delivers a sprawling role-playing adventure with turn-based combat and meaningful choices. Rich characters and high replay value make it a celebrated RPG.,"{""platform"": ""PC"", ""genre"": ""Action RPG"", ""pegi_rating"": ""18"", ""edition"": ""Deluxe"", ""release_year"": 2023}"
SKU-0124,Call of Duty: Modern Warfare III,Activision,Video Games,69.0,Fast-paced first-person shooter.,Presented by Fnac.fr. Modern Warfare III continues the series with a fast multiplayer suite and a campaign mode. Competitive shooting and seasonal content make it a fixture for FPS players.,"{""platform"": ""PlayStation 5"", ""genre"": ""FPS"", ""pegi_rating"": ""18"", ""edition"": ""Standard"", ""release_year"": 2023}"
SKU-0125,Civilization VI,2K Games,Video Games,29.0,Turn-based strategy across human history.,Presented by Fnac.fr. Civilization VI tasks players with building an empire to stand the test of time across the ages. Deep systems and high replayability make it a long-favoured strategy game.,"{""platform"": ""PC"", ""genre"": ""Strategy"", ""pegi_rating"": ""12"", ""edition"": ""Standard"", ""release_year"": 2016}"
SKU-0126,The Sims 4,Maxis,Video Games,39.0,Life simulation with creative building tools.,"Presented by Fnac.fr. The Sims 4 lets players create characters, build homes, and shape everyday life stories. Extensive customisation and ongoing content updates make it a long-running simulation favourite.","{""platform"": ""PC"", ""genre"": ""Simulation"", ""pegi_rating"": ""12"", ""edition"": ""Standard"", ""release_year"": 2014}"
SKU-0127,Sony DualSense Wireless Controller,Sony,Controllers,69.0,PS5 controller with haptic feedback and adaptive triggers.,Presented by Fnac.fr. The DualSense brings haptic feedback and adaptive triggers for more tactile play on PlayStation 5. A built-in mic and comfortable grip make it the standard controller for PS5 gaming.,"{""platform_compatibility"": ""PlayStation 5, PC"", ""connectivity"": ""Wired + Wireless"", ""color"": ""White"", ""battery_life_hours"": 12}"
SKU-0128,Microsoft Xbox Wireless Controller,Microsoft,Controllers,59.0,Versatile controller for Xbox and PC.,Presented by Fnac.fr. The Xbox Wireless Controller offers a comfortable design and broad compatibility across Xbox and PC. Textured grips and a hybrid D-pad make it a dependable all-round gamepad.,"{""platform_compatibility"": ""Xbox, PC"", ""connectivity"": ""Wired + Wireless"", ""color"": ""Carbon Black"", ""battery_life_hours"": 40}"
SKU-0129,Sony DualSense Edge,Sony,Controllers,239.0,Pro PS5 controller with customisable controls.,"Presented by Fnac.fr. The DualSense Edge adds swappable sticks, back buttons, and custom profiles for competitive PS5 players. Tunable triggers and a carrying case make it a premium option for serious gamers.","{""platform_compatibility"": ""PlayStation 5, PC"", ""connectivity"": ""Wired + Wireless"", ""color"": ""White"", ""battery_life_hours"": 10}"
SKU-0130,Microsoft Xbox Elite Series 2,Microsoft,Controllers,179.0,Pro Xbox controller with adjustable components.,"Presented by Fnac.fr. The Xbox Elite Series 2 offers interchangeable sticks, paddles, and tension settings for competitive play. A rechargeable battery and custom profiles make it a top choice for Xbox and PC.","{""platform_compatibility"": ""Xbox, PC"", ""connectivity"": ""Wired + Wireless"", ""color"": ""Black"", ""battery_life_hours"": 40}"
SKU-0131,8BitDo Ultimate Bluetooth Controller,8BitDo,Controllers,69.0,Feature-rich controller with a charging dock.,"Presented by Fnac.fr. The 8BitDo Ultimate offers Hall-effect sticks, back buttons, and a charging dock for Switch and PC. Custom profiles and solid build quality make it a value-packed enthusiast pad.","{""platform_compatibility"": ""Nintendo Switch, PC"", ""connectivity"": ""Wired + Wireless"", ""color"": ""Black"", ""battery_life_hours"": 22}"
SKU-0132,Nintendo Switch Pro Controller,Nintendo,Controllers,69.0,Comfortable controller for Switch gaming.,Presented by Fnac.fr. The Switch Pro Controller offers a comfortable full-size design with long battery life and motion controls. A solid D-pad and HD rumble make it the preferred pad for serious Switch play.,"{""platform_compatibility"": ""Nintendo Switch, PC"", ""connectivity"": ""Wired + Wireless"", ""color"": ""Black"", ""battery_life_hours"": 40}"
SKU-0133,Razer Wolverine V2 Chroma,Razer,Controllers,149.0,Wired pro controller with extra buttons.,Presented by Fnac.fr. The Wolverine V2 Chroma adds remappable buttons and mecha-tactile actions for competitive Xbox and PC play. RGB lighting and a robust build make it a tournament-minded wired pad.,"{""platform_compatibility"": ""Xbox, PC"", ""connectivity"": ""Wired"", ""color"": ""Black"", ""battery_life_hours"": 0}"
SKU-0134,SCUF Reflex Pro,SCUF,Controllers,259.0,Premium PS5 controller with back paddles.,"Presented by Fnac.fr. The SCUF Reflex Pro adds back paddles, adjustable triggers, and a grippy finish for competitive PS5 play. Customisable layouts make it a high-end controller for dedicated players.","{""platform_compatibility"": ""PlayStation 5, PC"", ""connectivity"": ""Wired + Wireless"", ""color"": ""Black"", ""battery_life_hours"": 10}"
SKU-0135,PowerA Enhanced Wired Controller,PowerA,Controllers,34.0,Affordable wired controller for Switch.,"Presented by Fnac.fr. The PowerA Enhanced Wired Controller offers a budget-friendly, full-size design with mappable buttons. A reliable wired connection makes it a practical spare for Switch and PC.","{""platform_compatibility"": ""Nintendo Switch, PC"", ""connectivity"": ""Wired"", ""color"": ""Black"", ""battery_life_hours"": 0}"
SKU-0136,De'Longhi Magnifica S Bean-to-Cup Coffee Machine,De'Longhi,Coffee Machines,399.0,Freshly ground espresso and cappuccino at the touch of a button.,"Presented by Fnac.fr. The Magnifica S grinds beans on demand and pulls 15-bar espresso, with a manual steam wand for cappuccinos and lattes. A 1.8 L water tank and removable brew unit keep daily use and cleaning simple.","{""type"": ""Bean-to-cup"", ""pressure_bar"": 15, ""capacity_l"": 1.8, ""color"": ""Silver"", ""milk_frother"": ""Yes""}"
SKU-0137,Breville Barista Express,Breville,Coffee Machines,699.0,Hands-on espresso machine with an integrated grinder.,Presented by Fnac.fr. The Barista Express combines a conical burr grinder with a 15-bar pump for hands-on espresso making. A steam wand and dose control let home baristas dial in their shots and milk texture.,"{""type"": ""Espresso"", ""pressure_bar"": 15, ""capacity_l"": 2.0, ""color"": ""Stainless Steel"", ""milk_frother"": ""Yes""}"
SKU-0138,Nespresso Vertuo Next,Nespresso,Coffee Machines,149.0,Capsule machine for coffee and espresso at one touch.,Presented by Fnac.fr. The Vertuo Next brews a range of cup sizes from capsules using a centrifugal extraction system. A compact footprint and one-touch operation make it a simple option for everyday coffee.,"{""type"": ""Capsule"", ""pressure_bar"": 0, ""capacity_l"": 1.1, ""color"": ""Black"", ""milk_frother"": ""No""}"
SKU-0139,Philips 5400 Series LatteGo,Philips,Coffee Machines,749.0,Bean-to-cup machine with easy-clean milk system.,"Presented by Fnac.fr. The Philips 5400 Series grinds beans for a range of drinks, with a LatteGo milk system that rinses quickly. A touch display and multiple profiles make varied coffee menus straightforward at home.","{""type"": ""Bean-to-cup"", ""pressure_bar"": 15, ""capacity_l"": 1.8, ""color"": ""Black"", ""milk_frother"": ""Yes""}"
SKU-0140,Moccamaster KBG Select,Moccamaster,Coffee Machines,329.0,Precision filter machine for balanced batch coffee.,"Presented by Fnac.fr. The Moccamaster KBG Select brews filter coffee at an optimal temperature for a clean, balanced cup. A copper heating element and durable build make it a long-lasting choice for batch brewing.","{""type"": ""Filter"", ""pressure_bar"": 0, ""capacity_l"": 1.25, ""color"": ""Matte Black"", ""milk_frother"": ""No""}"
SKU-0141,Sage Bambino Plus,Sage,Coffee Machines,399.0,Compact espresso machine with automatic milk texturing.,Presented by Fnac.fr. The Bambino Plus packs 15-bar espresso and automatic milk texturing into a small footprint. Fast heat-up and easy steaming make it a tidy choice for small kitchens.,"{""type"": ""Espresso"", ""pressure_bar"": 15, ""capacity_l"": 1.9, ""color"": ""Stainless Steel"", ""milk_frother"": ""Yes""}"
SKU-0142,Smeg ECF01 Espresso Machine,Smeg,Coffee Machines,449.0,Retro-styled espresso machine for the home.,Presented by Fnac.fr. The Smeg ECF01 pairs 1950s-inspired styling with a 15-bar pump and a steam wand for espresso and milk drinks. A compact design and bold colours make it a statement piece for the kitchen.,"{""type"": ""Espresso"", ""pressure_bar"": 15, ""capacity_l"": 1.0, ""color"": ""Cream"", ""milk_frother"": ""Yes""}"
SKU-0143,Hario V60 Pour-Over Kit,Hario,Coffee Machines,39.0,Manual pour-over kit for hands-on brewing.,Presented by Fnac.fr. The Hario V60 kit supports manual pour-over brewing for control over extraction and flavour. A simple dripper and server make it a low-cost entry into specialty coffee.,"{""type"": ""Manual"", ""pressure_bar"": 0, ""capacity_l"": 0.6, ""color"": ""White"", ""milk_frother"": ""No""}"
SKU-0144,Jura E8,Jura,Coffee Machines,1399.0,Automatic bean-to-cup machine for varied drinks.,Presented by Fnac.fr. The Jura E8 grinds beans and prepares a wide menu of coffee and milk drinks at the touch of a button. An automatic milk system and self-cleaning cycles make it a low-effort premium option.,"{""type"": ""Bean-to-cup"", ""pressure_bar"": 15, ""capacity_l"": 1.9, ""color"": ""Chrome"", ""milk_frother"": ""Yes""}"
SKU-0145,Dyson V15 Detect,Dyson,Vacuum Cleaners,749.0,Cordless stick vacuum with a laser dust display.,Presented by Fnac.fr. The Dyson V15 Detect uses a laser to reveal fine dust and shows particle counts on its display. Strong suction and a swappable battery make it a thorough cordless cleaner for whole-home use.,"{""type"": ""Stick"", ""power_w"": 230, ""battery_life_min"": 60, ""dust_capacity_l"": 0.76, ""bagless"": ""Yes""}"
SKU-0146,iRobot Roomba j7+,iRobot,Vacuum Cleaners,599.0,Robot vacuum that empties itself and avoids obstacles.,Presented by Fnac.fr. The Roomba j7+ navigates around obstacles and empties itself into a sealed base after cleaning. Smart mapping and app scheduling make it a hands-off option for everyday floor care.,"{""type"": ""Robot"", ""power_w"": 40, ""battery_life_min"": 75, ""dust_capacity_l"": 0.4, ""bagless"": ""No""}"
SKU-0147,Shark Stratos Cordless,Shark,Vacuum Cleaners,449.0,Cordless vacuum with anti-hair-wrap brushroll.,Presented by Fnac.fr. The Shark Stratos Cordless pairs strong suction with an anti-hair-wrap brushroll for homes with pets. A removable battery and odour-neutralising tech make it a practical all-rounder.,"{""type"": ""Stick"", ""power_w"": 200, ""battery_life_min"": 60, ""dust_capacity_l"": 0.7, ""bagless"": ""Yes""}"
SKU-0148,Miele Triflex HX2,Miele,Vacuum Cleaners,599.0,Versatile cordless vacuum with flexible modes.,Presented by Fnac.fr. The Miele Triflex HX2 adapts between handheld and floor modes with a reconfigurable design. Strong suction and a durable build make it a long-lasting cordless choice.,"{""type"": ""Stick"", ""power_w"": 190, ""battery_life_min"": 60, ""dust_capacity_l"": 0.5, ""bagless"": ""Yes""}"
SKU-0149,Roborock S8 Pro Ultra,Roborock,Vacuum Cleaners,1499.0,Robot vacuum and mop with an all-in-one dock.,"Presented by Fnac.fr. The Roborock S8 Pro Ultra vacuums and mops, then self-empties, washes, and refills at its dock. Precise mapping and obstacle avoidance make it a comprehensive hands-off cleaner.","{""type"": ""Robot"", ""power_w"": 60, ""battery_life_min"": 180, ""dust_capacity_l"": 0.4, ""bagless"": ""No""}"
SKU-0150,Tineco Pure One S15,Tineco,Vacuum Cleaners,499.0,Smart cordless vacuum that adjusts suction.,Presented by Fnac.fr. The Tineco Pure One S15 uses a dust sensor to adjust suction automatically as it cleans. A clear display and removable battery make it an adaptable cordless cleaner.,"{""type"": ""Stick"", ""power_w"": 180, ""battery_life_min"": 50, ""dust_capacity_l"": 0.6, ""bagless"": ""Yes""}"
SKU-0151,Dyson V12 Detect Slim,Dyson,Vacuum Cleaners,599.0,Lightweight cordless vacuum with dust detection.,"Presented by Fnac.fr. The Dyson V12 Detect Slim offers laser dust detection in a lighter, more manageable body. Strong suction and an easy-empty bin make it a nimble choice for daily cleaning.","{""type"": ""Stick"", ""power_w"": 150, ""battery_life_min"": 60, ""dust_capacity_l"": 0.35, ""bagless"": ""Yes""}"
SKU-0152,Eufy RoboVac X10 Pro Omni,Eufy,Vacuum Cleaners,799.0,Self-cleaning robot vacuum and mop.,Presented by Fnac.fr. The Eufy RoboVac X10 Pro Omni vacuums and mops with a dock that empties and washes automatically. Smart navigation and app control make it a low-maintenance everyday helper.,"{""type"": ""Robot"", ""power_w"": 55, ""battery_life_min"": 120, ""dust_capacity_l"": 0.4, ""bagless"": ""No""}"
SKU-0153,Black+Decker Dustbuster AdvancedClean,Black+Decker,Vacuum Cleaners,59.0,Compact handheld vacuum for quick clean-ups.,Presented by Fnac.fr. The Dustbuster AdvancedClean handles spills and crumbs with a lightweight cordless design. A washable filter and easy-empty bin make it a handy car and home companion.,"{""type"": ""Handheld"", ""power_w"": 50, ""battery_life_min"": 20, ""dust_capacity_l"": 0.5, ""bagless"": ""Yes""}"
SKU-0154,Tefal Ingenio Expertise 10-Piece Set,Tefal,Cookware Sets,199.0,Space-saving non-stick set with detachable handles.,Presented by Fnac.fr. The Ingenio Expertise set uses detachable handles so pans stack neatly and move from hob to oven. A durable non-stick coating and induction base make it a flexible everyday choice.,"{""material"": ""Non-stick"", ""pieces"": 10, ""induction_compatible"": ""Yes"", ""dishwasher_safe"": ""Yes"", ""color"": ""Black""}"
SKU-0155,Le Creuset Signature 5-Piece Set,Le Creuset,Cookware Sets,899.0,Enamelled cast iron set for slow cooking and braising.,"Presented by Fnac.fr. The Le Creuset Signature set offers enamelled cast iron built for even heat and long-term durability. Oven-safe and induction-ready, it suits braising, stews, and slow-cooked dishes.","{""material"": ""Cast iron"", ""pieces"": 5, ""induction_compatible"": ""Yes"", ""dishwasher_safe"": ""Yes"", ""color"": ""Volcanic""}"
SKU-0156,All-Clad D3 Stainless 10-Piece Set,All-Clad,Cookware Sets,999.0,Tri-ply stainless steel set for precise cooking.,"Presented by Fnac.fr. The All-Clad D3 set uses tri-ply stainless steel for even heating and responsive temperature control. Oven- and induction-safe, it is built for searing, sauces, and everyday precision cooking.","{""material"": ""Stainless steel"", ""pieces"": 10, ""induction_compatible"": ""Yes"", ""dishwasher_safe"": ""Yes"", ""color"": ""Silver""}"
SKU-0157,GreenPan Valencia Pro 11-Piece Set,GreenPan,Cookware Sets,299.0,Ceramic non-stick set free of common coatings.,Presented by Fnac.fr. The Valencia Pro set features a ceramic non-stick coating designed for easy release and cleaning. An induction-compatible base and oven-safe build make it a versatile everyday set.,"{""material"": ""Ceramic"", ""pieces"": 11, ""induction_compatible"": ""Yes"", ""dishwasher_safe"": ""Yes"", ""color"": ""Grey""}"
SKU-0158,Tefal Jamie Oliver Quick & Easy 5-Piece Set,Tefal,Cookware Sets,159.0,Stainless steel set with a heat indicator.,"Presented by Fnac.fr. This stainless steel set includes a Thermo-Spot indicator that shows when pans reach cooking temperature. Induction-ready and dishwasher-safe, it covers everyday frying and boiling.","{""material"": ""Stainless steel"", ""pieces"": 5, ""induction_compatible"": ""Yes"", ""dishwasher_safe"": ""Yes"", ""color"": ""Silver""}"
SKU-0159,Ninja Foodi ZeroStick 5-Piece Set,Ninja,Cookware Sets,179.0,Durable non-stick set built for daily cooking.,Presented by Fnac.fr. The Ninja Foodi ZeroStick set offers a hard-wearing non-stick coating for low-effort everyday cooking. An induction base and oven-safe handles make it a practical all-round set.,"{""material"": ""Non-stick"", ""pieces"": 5, ""induction_compatible"": ""Yes"", ""dishwasher_safe"": ""Yes"", ""color"": ""Grey""}"
SKU-0160,Lodge Cast Iron 3-Piece Set,Lodge,Cookware Sets,99.0,Pre-seasoned cast iron for searing and baking.,"Presented by Fnac.fr. The Lodge Cast Iron set comes pre-seasoned and ready for searing, frying, and baking. Oven- and induction-safe, it is a durable, budget-friendly choice that improves with use.","{""material"": ""Cast iron"", ""pieces"": 3, ""induction_compatible"": ""Yes"", ""dishwasher_safe"": ""No"", ""color"": ""Black""}"
SKU-0161,Circulon Premier Professional 13-Piece Set,Circulon,Cookware Sets,249.0,Hard-anodised non-stick set with raised circles.,"Presented by Fnac.fr. The Circulon Premier set uses a hard-anodised body with raised circles to protect its non-stick coating. Induction-ready and oven-safe, it is built for frequent, varied cooking.","{""material"": ""Non-stick"", ""pieces"": 13, ""induction_compatible"": ""Yes"", ""dishwasher_safe"": ""Yes"", ""color"": ""Bronze""}"
SKU-0162,ProCook Elite Tri-Ply 5-Piece Set,ProCook,Cookware Sets,279.0,Tri-ply stainless steel set for responsive cooking.,"Presented by Fnac.fr. The ProCook Elite Tri-Ply set offers a tri-ply stainless body for even heat across the base and sides. Oven- and induction-safe, it suits searing, sauces, and precise everyday cooking.","{""material"": ""Stainless steel"", ""pieces"": 5, ""induction_compatible"": ""Yes"", ""dishwasher_safe"": ""Yes"", ""color"": ""Silver""}"
SKU-0163,Project Hail Mary,Penguin Random House,Books,12.99,A lone astronaut's mission to save humanity.,Presented by Fnac.fr. Project Hail Mary follows a lone astronaut who wakes with amnesia on a mission to avert an extinction event. Andy Weir blends problem-solving science with an engaging plot for readers who enjoy grounded science fiction.,"{""author"": ""Andy Weir"", ""genre"": ""Science Fiction"", ""format"": ""Paperback"", ""pages"": 496, ""language"": ""English""}"
SKU-0164,Atomic Habits,Penguin Random House,Books,16.99,A practical framework for building better habits.,"Presented by Fnac.fr. Atomic Habits lays out a system for forming good habits and breaking bad ones through small, consistent changes. James Clear offers actionable strategies for readers focused on personal improvement.","{""author"": ""James Clear"", ""genre"": ""Self-help"", ""format"": ""Hardcover"", ""pages"": 320, ""language"": ""English""}"
SKU-0165,Sapiens: A Brief History of Humankind,HarperCollins,Books,14.99,A sweeping account of human history.,"Presented by Fnac.fr. Sapiens traces the history of our species from early foragers to modern societies and economies. Yuval Noah Harari connects biology, culture, and history for readers interested in big-picture non-fiction.","{""author"": ""Yuval Noah Harari"", ""genre"": ""Non-fiction"", ""format"": ""Paperback"", ""pages"": 498, ""language"": ""English""}"
SKU-0166,The Midnight Library,Canongate Books,Books,9.99,A novel about the lives we might have lived.,Presented by Fnac.fr. The Midnight Library imagines a place between life and death where each book is a different life path. Matt Haig explores regret and possibility in a reflective story for fans of contemporary fiction.,"{""author"": ""Matt Haig"", ""genre"": ""Fiction"", ""format"": ""Paperback"", ""pages"": 304, ""language"": ""English""}"
SKU-0167,A Game of Thrones,HarperCollins,Books,11.99,The first volume of an epic fantasy saga.,"Presented by Fnac.fr. A Game of Thrones opens George R. R. Martin's saga of warring houses, shifting loyalties, and looming threats. Its intricate plotting and large cast make it a cornerstone of modern epic fantasy.","{""author"": ""George R. R. Martin"", ""genre"": ""Fantasy"", ""format"": ""Paperback"", ""pages"": 864, ""language"": ""English""}"
SKU-0168,Educated,HarperCollins,Books,13.99,A memoir of self-taught transformation.,"Presented by Fnac.fr. Educated recounts Tara Westover's path from an isolated upbringing to formal education and a doctorate. The memoir examines family, belief, and the cost of forging one's own way.","{""author"": ""Tara Westover"", ""genre"": ""Biography"", ""format"": ""Hardcover"", ""pages"": 352, ""language"": ""English""}"
SKU-0169,Gone Girl,Orion Publishing,Books,10.99,A twisting thriller about a marriage gone wrong.,"Presented by Fnac.fr. Gone Girl unspools the disappearance of a wife and the suspicion that falls on her husband. Gillian Flynn's sharp, unreliable narration drives a tense, twist-laden thriller.","{""author"": ""Gillian Flynn"", ""genre"": ""Thriller"", ""format"": ""Paperback"", ""pages"": 463, ""language"": ""English""}"
SKU-0170,Le Petit Prince,Gallimard,Books,8.99,A timeless fable of a traveller from the stars.,"Presented by Fnac.fr. Le Petit Prince follows a young traveller from a distant asteroid as he reflects on love, loss, and what matters. Antoine de Saint-Exupery's gentle fable continues to resonate with readers of all ages.","{""author"": ""Antoine de Saint-Exupery"", ""genre"": ""Children"", ""format"": ""Hardcover"", ""pages"": 96, ""language"": ""French""}"
